{
    "event_id": "550e8400-e29b-41d4-a716-446655440000",
    "event_type": "example_event",
    "event_version": 1,
    "occurred_at": "2025-10-23T12:00:00Z",
    "correlation_id": "batch-import-2025-10-23",
    "causation_id": "450e8400-e29b-41d4-a716-446655440099",
    "source_service": "data_service",
    "payload": {
        "example_field": "This is where contract-specific data goes"
    }
}
